{
  "$schema": "https://json-schema.org/draft/2020-12/schema",
  "$id": "https://construtor-pg.local/schemas/process-definition-v1.schema.json",
  "title": "Process Definition v1",
  "type": "object",
  "required": ["schemaVersion", "pageType", "program", "process"],
  "properties": {
    "schemaVersion": { "type": "string" },
    "pageType": { "const": "process" },
    "screenId": { "type": "string" },
    "program": {
      "type": "object",
      "required": ["title"],
      "properties": {
        "id": { "type": "string" },
        "screenId": { "type": "string" },
        "title": { "type": "string" },
        "subtitle": { "type": "string" },
        "version": { "type": "string" },
        "help": { "type": "object" },
        "logs": { "type": "object" }
      },
      "additionalProperties": true
    },
    "permissions": {
      "type": "object",
      "additionalProperties": { "type": "boolean" }
    },
    "dataSource": {
      "type": "object",
      "properties": {
        "api": {
          "type": "object",
          "properties": {
            "process": { "$ref": "#/$defs/endpoint" },
            "status": { "$ref": "#/$defs/endpoint" }
          },
          "additionalProperties": true
        }
      },
      "additionalProperties": true
    },
    "process": {
      "type": "object",
      "required": ["parameters"],
      "properties": {
        "parameters": {
          "type": "object",
          "required": ["fields"],
          "properties": {
            "title": { "type": "string" },
            "fields": {
              "type": "array",
              "items": { "$ref": "#/$defs/parameterField" }
            }
          },
          "additionalProperties": true
        },
        "actions": {
          "type": "object",
          "properties": {
            "process": {
              "type": "object",
              "properties": {
                "label": { "type": "string" },
                "icon": { "type": "string" },
                "permission": { "type": "string" }
              },
              "additionalProperties": true
            }
          },
          "additionalProperties": true
        },
        "endpoints": {
          "type": "object",
          "properties": {
            "process": { "$ref": "#/$defs/endpoint" },
            "status": { "$ref": "#/$defs/endpoint" }
          },
          "additionalProperties": true
        },
        "wait": {
          "type": "object",
          "properties": {
            "mode": { "enum": ["auto", "sse", "polling", "none"] },
            "message": { "type": "string" },
            "pollIntervalSeconds": {
              "type": "number",
              "minimum": 1
            },
            "eventSourceUrl": { "type": "string" },
            "events": {
              "type": "object",
              "properties": {
                "enabled": { "type": "boolean" },
                "url": { "type": "string" }
              },
              "additionalProperties": true
            }
          },
          "additionalProperties": true
        },
        "result": {
          "type": "object",
          "properties": {
            "type": { "enum": ["message", "grid", "report", "job"] },
            "openReportInNewTab": { "type": "boolean" }
          },
          "additionalProperties": true
        }
      },
      "additionalProperties": true
    }
  },
  "$defs": {
    "endpoint": {
      "oneOf": [
        { "type": "string" },
        {
          "type": "object",
          "properties": {
            "endpointId": { "type": "string" },
            "actionId": { "type": "string" },
            "url": { "type": "string" },
            "method": { "enum": ["GET", "POST"] }
          },
          "additionalProperties": true
        }
      ]
    },
    "parameterField": {
      "type": "object",
      "required": ["field", "label"],
      "properties": {
        "id": { "type": "string" },
        "field": { "type": "string" },
        "name": { "type": "string" },
        "label": { "type": "string" },
        "type": {
          "enum": ["text", "string", "number", "integer", "decimal", "date", "datetime", "boolean", "enum", "option", "dropdown"]
        },
        "required": { "type": "boolean" },
        "readonly": { "type": "boolean" },
        "defaultValue": {},
        "placeholder": { "type": "string" },
        "description": { "type": "string" },
        "options": {
          "type": "array",
          "items": {
            "oneOf": [
              { "type": "string" },
              {
                "type": "object",
                "properties": {
                  "value": {},
                  "text": { "type": "string" },
                  "label": { "type": "string" },
                  "id": {}
                },
                "additionalProperties": true
              }
            ]
          }
        }
      },
      "additionalProperties": true
    }
  },
  "additionalProperties": true
}
